{
  "agent_id": "linux-example-001",
  "batch_id": "11111111-1111-4111-8111-111111111111",
  "sent_at": "2026-01-01T00:00:00Z",
  "events": [{
    "event_id": "22222222-2222-4222-8222-222222222222",
    "agent_id": "linux-example-001",
    "hostname": "linux-example",
    "platform": "linux",
    "source": "linux_journal",
    "source_id": "linux-journal-l1",
    "event_code": "synthetic.service.start",
    "unit": "synthetic.service",
    "checkpoint": { "sequence": 1 },
    "deduplication": { "algorithm": "sha256_uuid", "inputs": ["agent_id", "source_id", "checkpoint.sequence", "event_code"] },
    "data_handling": { "raw_size_bytes": 18, "redacted_fields": [], "truncated_fields": [] },
    "event_time": "2026-01-01T00:00:00Z",
    "severity": "information",
    "message": "Synthetic Linux event",
    "raw": { "synthetic": true }
  }]
}
